{
  "schema_version": 1,
  "content_version": "0.8.0-core-weapon-modifications",
  "scope_note": "Only War Core Rulebook personal equipment. Vehicle records are identity placeholders only.",
  "sources": { "ow_core": { "title": "Only War Core Rulebook", "short": "OW Core" } },
  "craftsmanship_rules": {
    "source": { "book": "ow_core", "page": 167 },
    "tiers": {
      "Poor": {
        "ranged_weapon": [
          { "operation": "quality_add", "value": "Unreliable", "condition": { "base_quality_absent": "Unreliable" } },
          { "operation": "situational", "code": "jam_on_failed_hit", "summary": "Jams on any failed hit roll when the base weapon is already Unreliable.", "condition": { "base_quality_present": "Unreliable" } }
        ],
        "melee_weapon": [
          { "operation": "situational", "code": "weapon_skill_modifier", "value": -10, "summary": "-10 to Weapon Skill Tests made with this weapon." }
        ]
      },
      "Common": { "ranged_weapon": [], "melee_weapon": [] },
      "Good": {
        "ranged_weapon": [
          { "operation": "quality_remove_prefix", "value": "Unreliable", "condition": { "base_quality_present": "Unreliable" } },
          { "operation": "quality_add", "value": "Reliable", "condition": { "base_quality_absent": "Unreliable" } }
        ],
        "melee_weapon": [
          { "operation": "situational", "code": "weapon_skill_modifier", "value": 5, "summary": "+5 to Weapon Skill Tests made with this weapon." }
        ]
      },
      "Best": {
        "ranged_weapon": [
          { "operation": "situational", "code": "never_jams_or_overheats", "summary": "Treats jamming or overheating results as misses." }
        ],
        "melee_weapon": [
          { "operation": "situational", "code": "weapon_skill_modifier", "value": 10, "summary": "+10 to Weapon Skill Tests made with this weapon." },
          { "operation": "numeric_add", "target": "profile.damage_bonus", "value": 1 }
        ]
      }
    }
  },
  "items": [
    { "id": "laspistol", "name": "Laspistol", "category": "ranged_weapon", "family": "las", "ammunition_id": "charge_pack", "weight_kg": 1.5, "availability": "Common", "profile": { "class": "Pistol", "range_m": 30, "rate_of_fire": "S/2/-", "damage": "1d10+2 E", "penetration": 0, "magazine": 30, "reload": "Half", "qualities": ["Reliable"] }, "source": { "book": "ow_core", "page": 174 } },
    { "id": "lascarbine", "name": "Las carbine", "category": "ranged_weapon", "family": "las", "ammunition_id": "charge_pack", "weight_kg": 2.5, "availability": "Common", "profile": { "class": "Basic", "range_m": 75, "rate_of_fire": "S/2/-", "damage": "1d10+3 E", "penetration": 0, "magazine": 60, "reload": "Half", "qualities": ["Reliable"] }, "source": { "book": "ow_core", "page": 174 } },
    { "id": "m36_lasgun", "name": "M36 lasgun", "category": "ranged_weapon", "family": "las", "ammunition_id": "charge_pack", "weight_kg": 4, "availability": "Common", "profile": { "class": "Basic", "range_m": 100, "rate_of_fire": "S/3/-", "damage": "1d10+3 E", "penetration": 0, "magazine": 60, "reload": "Full", "qualities": ["Reliable"] }, "summary": "Standard lasgun profile; variable power settings are described at the cited page.", "source": { "book": "ow_core", "page": 175 } },
    { "id": "laslock", "name": "Laslock", "category": "ranged_weapon", "family": "las", "ammunition_id": "charge_cell", "weight_kg": 4, "availability": "Plentiful", "profile": { "class": "Basic", "range_m": 70, "rate_of_fire": "S/-/-", "damage": "1d10+4 E", "penetration": 0, "magazine": 1, "reload": "Half", "qualities": ["Unreliable"] }, "source": { "book": "ow_core", "page": 174 } },
    { "id": "long_las", "name": "Long-las", "category": "ranged_weapon", "family": "las", "ammunition_id": "charge_pack", "weight_kg": 4.5, "availability": "Scarce", "profile": { "class": "Basic", "range_m": 150, "rate_of_fire": "S/-/-", "damage": "1d10+3 E", "penetration": 1, "magazine": 40, "reload": "Full", "qualities": ["Accurate", "Reliable", "Felling (4)"] }, "source": { "book": "ow_core", "page": 174 } },
    { "id": "hot_shot_laspistol", "name": "Hot-shot laspistol", "category": "ranged_weapon", "family": "las", "ammunition_id": "charge_pack", "weight_kg": 4, "availability": "Rare", "profile": { "class": "Pistol", "range_m": 20, "rate_of_fire": "S/2/-", "damage": "1d10+4 E", "penetration": 7, "magazine": 40, "reload": "2 Full", "qualities": [] }, "source": { "book": "ow_core", "page": 174 } },
    { "id": "hot_shot_lasgun", "name": "Hot-shot lasgun", "category": "ranged_weapon", "family": "las", "ammunition_id": "charge_pack", "weight_kg": 6, "availability": "Rare", "profile": { "class": "Basic", "range_m": 60, "rate_of_fire": "S/3/-", "damage": "1d10+4 E", "penetration": 7, "magazine": 30, "reload": "2 Full", "qualities": [] }, "source": { "book": "ow_core", "page": 174 } },
    { "id": "man_portable_lascannon", "name": "Man-portable lascannon", "category": "ranged_weapon", "family": "las", "ammunition_id": "charge_pack_heavy", "weight_kg": 55, "availability": "Very Rare", "profile": { "class": "Heavy", "range_m": 300, "rate_of_fire": "S/-/-", "damage": "5d10+10 E", "penetration": 10, "magazine": 5, "reload": "2 Full", "qualities": ["Proven (3)"] }, "source": { "book": "ow_core", "page": 174 } },
    { "id": "autopistol", "name": "Autopistol", "category": "ranged_weapon", "family": "solid_projectile", "ammunition_id": "bullets", "weight_kg": 1.5, "availability": "Average", "profile": { "class": "Pistol", "range_m": 30, "rate_of_fire": "S/-/6", "damage": "1d10+2 I", "penetration": 0, "magazine": 18, "reload": "Full", "qualities": [] }, "source": { "book": "ow_core", "page": 174 } },
    { "id": "stub_automatic", "name": "Stub automatic", "category": "ranged_weapon", "family": "solid_projectile", "ammunition_id": "bullets", "weight_kg": 1.5, "availability": "Average", "profile": { "class": "Pistol", "range_m": 30, "rate_of_fire": "S/3/-", "damage": "1d10+3 I", "penetration": 0, "magazine": 9, "reload": "Full", "qualities": [] }, "source": { "book": "ow_core", "page": 174 } },
    { "id": "stub_revolver", "name": "Stub revolver", "category": "ranged_weapon", "family": "solid_projectile", "ammunition_id": "bullets", "weight_kg": 1.5, "availability": "Plentiful", "profile": { "class": "Pistol", "range_m": 30, "rate_of_fire": "S/-/-", "damage": "1d10+3 I", "penetration": 0, "magazine": 6, "reload": "2 Full", "qualities": ["Reliable"] }, "source": { "book": "ow_core", "page": 174 } },
    { "id": "hand_cannon", "name": "Hand cannon", "category": "ranged_weapon", "family": "solid_projectile", "ammunition_id": "bullets", "weight_kg": 3, "availability": "Scarce", "profile": { "class": "Pistol", "range_m": 35, "rate_of_fire": "S/-/-", "damage": "1d10+4 I", "penetration": 2, "magazine": 5, "reload": "2 Full", "qualities": [] }, "source": { "book": "ow_core", "page": 174 } },
    { "id": "sniper_rifle", "name": "Sniper rifle", "category": "ranged_weapon", "family": "solid_projectile", "ammunition_id": "bullets", "weight_kg": 5, "availability": "Scarce", "profile": { "class": "Basic", "range_m": 200, "rate_of_fire": "S/-/-", "damage": "1d10+4 I", "penetration": 3, "magazine": 20, "reload": "Full", "qualities": ["Accurate", "Reliable"] }, "source": { "book": "ow_core", "page": 174 } },
    { "id": "autogun", "name": "Autogun", "category": "ranged_weapon", "family": "solid_projectile", "ammunition_id": "bullets", "weight_kg": 5, "availability": "Average", "profile": { "class": "Basic", "range_m": 100, "rate_of_fire": "S/3/10", "damage": "1d10+3 I", "penetration": 0, "magazine": 30, "reload": "Full", "qualities": [] }, "source": { "book": "ow_core", "page": 174 } },
    { "id": "shotgun", "name": "Shotgun", "category": "ranged_weapon", "family": "solid_projectile", "ammunition_id": "cartridge", "weight_kg": 5, "availability": "Average", "profile": { "class": "Basic", "range_m": 30, "rate_of_fire": "S/-/-", "damage": "1d10+4 I", "penetration": 0, "magazine": 8, "reload": "2 Full", "qualities": ["Scatter"] }, "source": { "book": "ow_core", "page": 174 } },
    { "id": "combat_shotgun", "name": "Combat shotgun", "category": "ranged_weapon", "family": "solid_projectile", "ammunition_id": "cartridge", "weight_kg": 6.5, "availability": "Scarce", "profile": { "class": "Basic", "range_m": 30, "rate_of_fire": "S/3/-", "damage": "1d10+4 I", "penetration": 0, "magazine": 18, "reload": "Full", "qualities": ["Scatter"] }, "source": { "book": "ow_core", "page": 174 } },
    { "id": "heavy_stubber", "name": "Heavy stubber", "category": "ranged_weapon", "family": "solid_projectile", "ammunition_id": "bullets", "weight_kg": 30, "availability": "Rare", "profile": { "class": "Heavy", "range_m": 100, "rate_of_fire": "-/-/8", "damage": "1d10+4 I", "penetration": 3, "magazine": 75, "reload": "2 Full", "qualities": ["Ogryn-Proof"] }, "source": { "book": "ow_core", "page": 174 } },
    { "id": "autocannon", "name": "M34 autocannon", "category": "ranged_weapon", "family": "solid_projectile", "ammunition_id": "bullets", "weight_kg": 40, "availability": "Very Rare", "profile": { "class": "Heavy", "range_m": 300, "rate_of_fire": "S/3/-", "damage": "3d10+8 I", "penetration": 6, "magazine": 20, "reload": "2 Full", "qualities": ["Ogryn-Proof", "Reliable"] }, "source": { "book": "ow_core", "page": 174 } },
    { "id": "bolt_pistol", "name": "Bolt pistol", "category": "ranged_weapon", "family": "bolt", "ammunition_id": "bolt_shells", "weight_kg": 3.5, "availability": "Very Rare", "profile": { "class": "Pistol", "range_m": 30, "rate_of_fire": "S/2/-", "damage": "1d10+5 X", "penetration": 4, "magazine": 8, "reload": "Full", "qualities": ["Tearing"] }, "source": { "book": "ow_core", "page": 174 } },